### ISSUE TITLE
Unable to access local nodes when using topologies

### ISSUE THREAD

**Issue by kelvl** [squat/kilo#29]
Hi Lucas!

Thank you for this great project! 

I am trying to set up a multi provider k3s cluster using kilo. The machines roughly look like:
1. `oci` location - 2 machines (both only has local ip address assigned to the local interfaces, ext ips are managed via the internet gateway of the cloud provider)
2. `gcp` location - 1 machine

I haven't got to doing a multi provider setup yet. I am still trying to get the 2 machines in `oci` to talk to each other. 

I am trying to use kilo as CNI directly, the network configuration is as follows:
`oci-master` - internal ip 10.1.20.3, external <ext-ip-master> (using placeholders here)
`oci-worker` - internal ip 10.1.20.2, external <ext-ip-worker> 

The machines can ping each other directly using the 10.1.20.x addresses.

My issue is that, once they come up, I can't get the pods launched on each machine to talk to each other. 
I can ping pods on the machines that runs it, but not from master -> worker and vice versa. 

on my laptop
```
> kubectl get po -o wide
NAME                        READY   STATUS    RESTARTS   AGE   IP          NODE         NOMINATED NODE   READINESS GATES
my-nginx-74f94c7795-j7kzv   1/1     Running   0          99m   10.42.1.5   oci-worker   <none>           <none>
```

but on `oci-master`
```
> ping 10.42.1.5
PING 10.42.1.5 (10.42.1.5): 56 data bytes
^C--- 10.42.1.5 ping statistics ---
4 packets transmitted, 0 packets received, 100% packet loss
```

I _think_ i should be able to reach every pod from any node on the cluster (AFAIK). 

Please let me know if there is additional info that would be helpful to include!

### My setup details are below

I provisioned the machines as follows:
`oci-master`: 
```
k3sup install \
    --ip <ext-master-ip> \
    --k3s-version 'v1.17.0+k3s.1' \
    --k3s-extra-args '--no-flannel --no-deploy metrics-server --no-deploy servicelb --no-deploy traefik --default-local-storage-path /k3s-local-storage --node-name oci-master --node-external-ip <ext-master-ip> --node-ip 10.1.20.3'

kubectl annotate node oci-master \
    kilo.squat.ai/force-external-ip="<ext-ip-master>/32" \
    kilo.squat.ai/force-internal-ip="10.1.20.3/24" \
    kilo.squat.ai/location="oci" \
    kilo.squat.ai/leader="true" 
```

`oci-worker`: 
```
k3sup join \
    --ip <ext-worker-ip> \
    --server-ip <ext-master-ip> \
    --k3s-version 'v1.17.0+k3s.1' \
    --k3s-extra-args '--no-flannel --node-name oci-worker --node-external-ip <ext-worker-ip> --node-ip 10.1.20.2''

kubectl annotate node oci-worker \
    kilo.squat.ai/force-external-ip="<ext-worker-ip>/32" \
    kilo.squat.ai/force-internal-ip="10.1.20.2/24" \
    kilo.squat.ai/location="oci" 
```

Finally setting up kilo
```
kubectl apply -f k3s-kilo.yaml
```

I had to do the same changes suggested in #11 and #27 to make sure that kilo pods has the correct permissions, but I was able to get the pods to come up correctly. 

I am able see logs like these when taking pod logs (with log-level=debug)
on `oci-master`
```
{"caller":"mesh.go:410","component":"kilo","event":"update","level":"debug","msg":"syncing nodes","ts":"2020-02-09T09:12:46.095414595Z"}
{"caller":"mesh.go:412","component":"kilo","event":"update","level":"debug","msg":"processing local node","node":{"ExternalIP":{"IP":"<ext-ip-master>","Mask":"/////w=="},"Key":"<key>","InternalIP":{"IP":"10.1.20.3","Mask":"////AA=="},"LastSeen":1581239566,"Leader":true,"Location":"oci","Name":"oci-master","Subnet":{"IP":"10.42.0.0","Mask":"////AA=="},"WireGuardIP":{"IP":"10.4.0.1","Mask":"//8AAA=="}},"ts":"2020-02-09T09:12:46.095454981Z"}
```

on `oci-worker`
```
{"caller":"mesh.go:410","component":"kilo","event":"update","level":"debug","msg":"syncing nodes","ts":"2020-02-09T10:44:48.564218597Z"}
{"caller":"mesh.go:508","component":"kilo","level":"debug","msg":"successfully checked in local node in backend","ts":"2020-02-09T10:45:18.478913052Z"}
{"caller":"mesh.go:675","component":"kilo","level":"debug","msg":"local node is not the leader","ts":"2020-02-09T10:45:18.4804814Z"}      
{"caller":"mesh.go:410","component":"kilo","event":"update","level":"debug","msg":"syncing nodes","ts":"2020-02-09T10:45:18.481320232Z"}  
{"caller":"mesh.go:412","component":"kilo","event":"update","level":"debug","msg":"processing local node","node":{"ExternalIP":{"IP":"<ext-ip-worker>","Mask":"/////w=="},"Key":"<key>","InternalIP":{"IP":"10.1.20.2","Mask":"////AA=="},"LastSeen":1581245118,"Leader":false,"Location":"oci","Name":"oci-worker","Subnet":{"IP":"10.42.1.0","Mask":"////AA=="},"WireGuardIP":null},"ts":"2020-02-09T10:45:18.481367592Z"}
```

oci-master
```
> ifconfig
ens3: flags=4163<UP,BROADCAST,RUNNING,MULTICAST>  mtu 9000
        inet 10.1.20.3  netmask 255.255.255.0  broadcast 10.1.20.255
        inet6 fe80::200:17ff:fe02:2f31  prefixlen 64  scopeid 0x20<link>
        ether 00:00:17:02:2f:31  txqueuelen 1000  (Ethernet)
        RX packets 945623  bytes 2361330833 (2.3 GB)
        RX errors 0  dropped 0  overruns 0  frame 0
        TX packets 851708  bytes 304538145 (304.5 MB)
        TX errors 0  dropped 0 overruns 0  carrier 0  collisions 0

kilo0: flags=209<UP,POINTOPOINT,RUNNING,NOARP>  mtu 1420
        inet 10.4.0.1  netmask 255.255.0.0  destination 10.4.0.1
        unspec 00-00-00-00-00-00-00-00-00-00-00-00-00-00-00-00  txqueuelen 1000  (UNSPEC)
        RX packets 0  bytes 0 (0.0 B)
        RX errors 0  dropped 0  overruns 0  frame 0
        TX packets 0  bytes 0 (0.0 B)
        TX errors 0  dropped 0 overruns 0  carrier 0  collisions 0

lo: flags=73<UP,LOOPBACK,RUNNING>  mtu 65536
        inet 127.0.0.1  netmask 255.0.0.0
        inet6 ::1  prefixlen 128  scopeid 0x10<host>
        loop  txqueuelen 1000  (Local Loopback)
        RX packets 1354843  bytes 457783326 (457.7 MB)
        RX errors 0  dropped 0  overruns 0  frame 0
        TX packets 1354843  bytes 457783326 (457.7 MB)
        TX errors 0  dropped 0 overruns 0  carrier 0  collisions 0

tunl0: flags=193<UP,RUNNING,NOARP>  mtu 8980
        inet 10.42.0.1  netmask 255.255.255.255
        tunnel   txqueuelen 1000  (IPIP Tunnel)
        RX packets 0  bytes 0 (0.0 B)
        RX errors 0  dropped 0  overruns 0  frame 0
        TX packets 5  bytes 420 (420.0 B)
        TX errors 0  dropped 0 overruns 0  carrier 0  collisions 0

> ip route
default via 10.1.20.1 dev ens3
default via 10.1.20.1 dev ens3 proto dhcp src 10.1.20.3 metric 100
10.1.20.0/24 dev ens3 proto kernel scope link src 10.1.20.3
10.4.0.0/16 dev kilo0 proto kernel scope link src 10.4.0.1
10.42.1.0/24 via 10.1.20.2 dev tunl0 proto static onlink
```

oci-worker
```
> ifconfig
ens3: flags=4163<UP,BROADCAST,RUNNING,MULTICAST>  mtu 9000
        inet 10.1.20.2  netmask 255.255.255.0  broadcast 10.1.20.255
        inet6 fe80::200:17ff:fe02:1682  prefixlen 64  scopeid 0x20<link>
        ether 00:00:17:02:16:82  txqueuelen 1000  (Ethernet)
        RX packets 231380  bytes 781401888 (781.4 MB)
        RX errors 0  dropped 0  overruns 0  frame 0
        TX packets 221393  bytes 29979034 (29.9 MB)
        TX errors 0  dropped 0 overruns 0  carrier 0  collisions 0

kube-bridge: flags=4163<UP,BROADCAST,RUNNING,MULTICAST>  mtu 1500
        inet 10.42.1.1  netmask 255.255.255.0  broadcast 0.0.0.0
        inet6 fe80::38f7:34ff:fed9:897e  prefixlen 64  scopeid 0x20<link>
        ether 26:d7:aa:ce:37:f8  txqueuelen 1000  (Ethernet)
        RX packets 21865  bytes 10732037 (10.7 MB)
        RX errors 0  dropped 0  overruns 0  frame 0
        TX packets 19269  bytes 7046706 (7.0 MB)
        TX errors 0  dropped 0 overruns 0  carrier 0  collisions 0

lo: flags=73<UP,LOOPBACK,RUNNING>  mtu 65536
        inet 127.0.0.1  netmask 255.0.0.0
        inet6 ::1  prefixlen 128  scopeid 0x10<host>
        loop  txqueuelen 1000  (Local Loopback)
        RX packets 78258  bytes 29977684 (29.9 MB)
        RX errors 0  dropped 0  overruns 0  frame 0
        TX packets 78258  bytes 29977684 (29.9 MB)
        TX errors 0  dropped 0 overruns 0  carrier 0  collisions 0

tunl0: flags=193<UP,RUNNING,NOARP>  mtu 8980
        inet 10.42.1.1  netmask 255.255.255.255
        tunnel   txqueuelen 1000  (IPIP Tunnel)
        RX packets 0  bytes 0 (0.0 B)
        RX errors 0  dropped 0  overruns 0  frame 0
        TX packets 10  bytes 840 (840.0 B)
        TX errors 0  dropped 0 overruns 0  carrier 0  collisions 0

veth5ee1a633: flags=4163<UP,BROADCAST,RUNNING,MULTICAST>  mtu 1500
        inet6 fe80::24d7:aaff:fece:37f8  prefixlen 64  scopeid 0x20<link>
        ether 26:d7:aa:ce:37:f8  txqueuelen 0  (Ethernet)
        RX packets 12748  bytes 10219673 (10.2 MB)
        RX errors 0  dropped 0  overruns 0  frame 0
        TX packets 9890  bytes 4818258 (4.8 MB)
        TX errors 0  dropped 0 overruns 0  carrier 0  collisions 0

veth965708c2: flags=4163<UP,BROADCAST,RUNNING,MULTICAST>  mtu 1500
        inet6 fe80::9cfc:9dff:fef1:dc7a  prefixlen 64  scopeid 0x20<link>
        ether 9e:fc:9d:f1:dc:7a  txqueuelen 0  (Ethernet)
        RX packets 22  bytes 1636 (1.6 KB)
        RX errors 0  dropped 0  overruns 0  frame 0
        TX packets 21  bytes 1754 (1.7 KB)
        TX errors 0  dropped 0 overruns 0  carrier 0  collisions 0

vethd34408af: flags=4163<UP,BROADCAST,RUNNING,MULTICAST>  mtu 1500
        inet6 fe80::5077:76ff:fe3a:1b01  prefixlen 64  scopeid 0x20<link>
        ether 52:77:76:3a:1b:01  txqueuelen 0  (Ethernet)
        RX packets 9091  bytes 816526 (816.5 KB)
        RX errors 0  dropped 0  overruns 0  frame 0
        TX packets 9442  bytes 2233086 (2.2 MB)
        TX errors 0  dropped 0 overruns 0  carrier 0  collisions 0

> ip route
default via 10.1.20.1 dev ens3
default via 10.1.20.1 dev ens3 proto dhcp src 10.1.20.2 metric 100
10.1.20.0/24 dev ens3 proto kernel scope link src 10.1.20.2
10.4.0.1 via 10.1.20.3 dev tunl0 proto static onlink
10.42.0.0/24 via 10.1.20.3 dev tunl0 proto static onlink
10.42.1.0/24 dev kube-bridge proto kernel scope link src 10.42.1.1
169.254.0.0/16 dev ens3 proto dhcp scope link src 10.1.20.2 metric 100
```

### Other things that I've tried
Interestingly setting up another machine with a different region, I was able to see that the wireguard interfaces come up with correct allowed-ips and was even able to ping 10.1.20.2 (oci-worker) directly over wireguard. 
Presumably that is going from `gcp-worker` -> `oci-master` (leader for oci location) -> `oci-worker`

**Comment by squat** [comment]
Hi @kelvl thanks a lot for trying Kilo :D 
And yes you should absolutely be able to ping any pod from any other pod, that is essentially the only requirement of a Kubernetes networking provider. It seems like there is certainly a bug here but interestingly it seems to be an issue in the way the intra region communication is working. That means that all of the WireGuard stuff factor in but rather only the private networking and encapsulation.

Questions for you:
* What happens when from oci-master you ping oci-worker's private IP?
* in order to narrow down this bug to a particular subsystem, can we try running Kilo with encapsulation disabled? This would disabled the usage of IPIP. Encapsulation is used because cloud providers often force strict source/destination address checks on traffic in their network overlays, disallowing traffic where the IPs don't match the private IPs of the nodes. If you are not in a cloud that enforces this (or you disabled strict source checking in AWS/GCP) then we can experiment with this. Try running Kilo in this mode and see if it fixes the problem, then we have an avenue to debug

Please let me know how these experimenta go!

Thanks,
Lucas

PS is there a specific reason for explicitly setting the private IPs of the nodes? Are they not correctly discovered by Kilo?

**Comment by kelvl** [comment]
Thanks @squat, i'll try and reply in line.

> Hi @kelvl thanks a lot for trying Kilo :D
> And yes you should absolutely be able to ping any pod from any other pod, that is essentially the only requirement of a Kubernetes networking provider. It seems like there is certainly a bug here but interestingly it seems to be an issue in the way the intra region communication is working. That means that all of the WireGuard stuff factor in but rather only the private networking and encapsulation.
> 
> Questions for you:
> 
> * What happens when from oci-master you ping oci-worker's private IP?

I am able to get pings through:
```
root@kubeinstance0:~# ping 10.1.20.2
PING 10.1.20.2 (10.1.20.2): 56 data bytes
64 bytes from 10.1.20.2: icmp_seq=0 ttl=64 time=0.313 ms
^C--- 10.1.20.2 ping statistics ---
1 packets transmitted, 1 packets received, 0% packet loss
round-trip min/avg/max/stddev = 0.313/0.313/0.313/0.000 ms
root@kubeinstance0:~# ping 10.1.20.3
PING 10.1.20.3 (10.1.20.3): 56 data bytes
64 bytes from 10.1.20.3: icmp_seq=0 ttl=64 time=0.099 ms
64 bytes from 10.1.20.3: icmp_seq=1 ttl=64 time=0.051 ms
^C--- 10.1.20.3 ping statistics ---
2 packets transmitted, 2 packets received, 0% packet loss
round-trip min/avg/max/stddev = 0.051/0.075/0.099/0.024 ms
```

> * in order to narrow down this bug to a particular subsystem, can we try running Kilo with encapsulation disabled? This would disabled the usage of IPIP. Encapsulation is used because cloud providers often force strict source/destination address checks on traffic in their network overlays, disallowing traffic where the IPs don't match the private IPs of the nodes. If you are not in a cloud that enforces this (or you disabled strict source checking in AWS/GCP) then we can experiment with this. Try running Kilo in this mode and see if it fixes the problem, then we have an avenue to debug
>

I updated kilo-k3s.yaml and modified the command to add `--encapsulate=never` , validated that IPIP indeed is now disabled, but the problem persists
```
     - name: kilo
        image: squat/kilo
        args:
        - --kubeconfig=/var/lib/rancher/k3s/agent/kubeproxy.kubeconfig
        - --hostname=$(NODE_NAME)
        - --encapsulate=never
        - --log-level=all
```

How should the packets be flowing? maybe I can try adding some iptables logging to help debug this?

> Please let me know how these experimenta go!
> 
> Thanks,
> Lucas
> 
> PS is there a specific reason for explicitly setting the private IPs of the nodes? Are they not correctly discovered by Kilo?

No specific reasons, I just wanted to make sure nothing is left to chance :p I left them out and tried deploying again and kilo discovered the private IPs correctly!

**Comment by squat** [comment]
@kelvl ok great that is some progress since we can now eliminate an entire part of the stack. 

The packets should be using direct routing, that means packets addressed to your Pod IP directly on the layer 3 fabric between your two hosts. Note, without encapsulation will only work when the cloud provider does not drop packets it can't identify addresses for.

The next thing that would be good to investigate would be to ensure that the routes on machines match each other in order to verify that the packets are not being marked as martians and for that reason being dropped. So, I would say:
1. On oci-master: `ip route get <pod-ip>`
2. In one terminal `ping <pod-ip>`
3. In another terminal tcpdump look for host <pod-ip> and ensure no responses are coming. Plz take note of the source IP and report that
4. On oci-worker: `ip route get <source-ip>`, plz report that, we need to ensure it matches the interface in which incoming packets arrive
5. tcpdump look for host <pod-ip> we want to make sure the sources match here.

If the packets are coming in and the routes match, then we must have some broken IP tables rule causing the packets to be dropped or not forwarded.

Let me know what you find,
Lucas

**Comment by kelvl** [comment]
> @kelvl ok great that is some progress since we can now eliminate an entire part of the stack.
> 
> The packets should be using direct routing, that means packets addressed to your Pod IP directly on the layer 3 fabric between your two hosts. Note, without encapsulation will only work when the cloud provider does not drop packets it can't identify addresses for.
> 
> The next thing that would be good to investigate would be to ensure that the routes on machines match each other in order to verify that the packets are not being marked as martians and for that reason being dropped. So, I would say:

Interesting, they are indeed different
Using a pod running on oci-worker

```
laptop> kubectl get po -o wide
NAME                        READY   STATUS    RESTARTS   AGE   IP          NODE         NOMINATED NODE   READINESS GATES
my-nginx-74f94c7795-qhlkm   1/1     Running   0          21h   10.42.1.4   oci-worker   <none>           <none>
```


> 
> 1. On oci-master: `ip route get <pod-ip>`

oci-master's private ip is 10.1.20.3
```
oci-master> ip route get 10.42.1.4
10.42.1.4 via 10.1.20.2 dev ens3 src 10.1.20.3 uid 0
    cache
```

> 2. In one terminal `ping <pod-ip>`

```
> ping 10.42.1.4
PING 10.42.1.4 (10.42.1.4): 56 data bytes
^C--- 10.42.1.4 ping statistics ---
4 packets transmitted, 0 packets received, 100% packet loss
```

> 3. In another terminal tcpdump look for host  and ensure no responses are coming. Plz take note of the source IP and report that

tcp dump shows that the source is coming from 10.1.20.3 which i am guessing is correct.
```
> tcpdump -i any -n icmp
tcpdump: verbose output suppressed, use -v or -vv for full protocol decode
listening on any, link-type LINUX_SLL (Linux cooked), capture size 262144 bytes
11:23:31.578073 IP 10.1.20.3 > 10.42.1.4: ICMP echo request, id 1499, seq 0, length 64
11:23:32.578029 IP 10.1.20.3 > 10.42.1.4: ICMP echo request, id 1499, seq 1, length 64
11:23:33.579269 IP 10.1.20.3 > 10.42.1.4: ICMP echo request, id 1499, seq 2, length 64
11:23:34.580531 IP 10.1.20.3 > 10.42.1.4: ICMP echo request, id 1499, seq 3, length 64
```

> 4. On oci-worker: `ip route get <source-ip>`, plz report that, we need to ensure it matches the interface in which incoming packets arrive

oci-worker's private ip is 10.1.20.2
On oci-worker the route looks like it comes from kube-bridge -- i think this might be wrong?
```
>  ip route get 10.42.1.4
10.42.1.4 dev kube-bridge src 10.42.1.1 uid 0
    cache
```

> 5. tcpdump look for host  we want to make sure the sources match here.

Doing the same for ping
```
> ping 10.42.1.4
PING 10.42.1.4 (10.42.1.4): 56 data bytes
64 bytes from 10.42.1.4: icmp_seq=0 ttl=64 time=0.080 ms
64 bytes from 10.42.1.4: icmp_seq=1 ttl=64 time=0.058 ms
64 bytes from 10.42.1.4: icmp_seq=2 ttl=64 time=0.045 ms
64 bytes from 10.42.1.4: icmp_seq=3 ttl=64 time=0.048 ms
^C--- 10.42.1.4 ping statistics ---
4 packets transmitted, 4 packets received, 0% packet loss
round-trip min/avg/max/stddev = 0.045/0.058/0.080/0.000 ms
```

and tcpdump looks like its coming from the kube-bridge instead of 10.20.1.
```
> tcpdump -i any -n icmp
tcpdump: verbose output suppressed, use -v or -vv for full protocol decode
listening on any, link-type LINUX_SLL (Linux cooked), capture size 262144 bytes
11:27:31.706960 IP 10.42.1.1 > 10.42.1.4: ICMP echo request, id 2745, seq 0, length 64
11:27:31.706967 IP 10.42.1.1 > 10.42.1.4: ICMP echo request, id 2745, seq 0, length 64
11:27:31.706980 IP 10.42.1.4 > 10.42.1.1: ICMP echo reply, id 2745, seq 0, length 64
11:27:31.706980 IP 10.42.1.4 > 10.42.1.1: ICMP echo reply, id 2745, seq 0, length 64
11:27:32.708008 IP 10.42.1.1 > 10.42.1.4: ICMP echo request, id 2745, seq 1, length 64
11:27:32.708015 IP 10.42.1.1 > 10.42.1.4: ICMP echo request, id 2745, seq 1, length 64
11:27:32.708028 IP 10.42.1.4 > 10.42.1.1: ICMP echo reply, id 2745, seq 1, length 64
11:27:32.708028 IP 10.42.1.4 > 10.42.1.1: ICMP echo reply, id 2745, seq 1, length 64
```

> 
> If the packets are coming in and the routes match, then we must have some broken IP tables rule causing the packets to be dropped or not forwarded.

I think this looks like it could be iptables?

oci-master
```
> iptables -L -n
Chain INPUT (policy ACCEPT)
target     prot opt source               destination
KUBE-SERVICES  all  --  0.0.0.0/0            0.0.0.0/0            ctstate NEW /* kubernetes service portals */
KUBE-EXTERNAL-SERVICES  all  --  0.0.0.0/0            0.0.0.0/0            ctstate NEW /* kubernetes externally-visible service portals */KUBE-FIREWALL  all  --  0.0.0.0/0            0.0.0.0/0

Chain FORWARD (policy ACCEPT)
target     prot opt source               destination
KUBE-FORWARD  all  --  0.0.0.0/0            0.0.0.0/0            /* kubernetes forwarding rules */
KUBE-SERVICES  all  --  0.0.0.0/0            0.0.0.0/0            ctstate NEW /* kubernetes service portals */
ACCEPT     all  --  10.4.0.0/16          0.0.0.0/0
ACCEPT     all  --  0.0.0.0/0            10.4.0.0/16

Chain OUTPUT (policy ACCEPT)
target     prot opt source               destination
KUBE-SERVICES  all  --  0.0.0.0/0            0.0.0.0/0            ctstate NEW /* kubernetes service portals */
KUBE-FIREWALL  all  --  0.0.0.0/0            0.0.0.0/0

Chain KUBE-EXTERNAL-SERVICES (1 references)
target     prot opt source               destination

Chain KUBE-FIREWALL (2 references)
target     prot opt source               destination
DROP       all  --  0.0.0.0/0            0.0.0.0/0            /* kubernetes firewall for dropping marked packets */ mark match 0x8000/0x8000

Chain KUBE-FORWARD (1 references)
target     prot opt source               destination
DROP       all  --  0.0.0.0/0            0.0.0.0/0            ctstate INVALID
ACCEPT     all  --  0.0.0.0/0            0.0.0.0/0            /* kubernetes forwarding rules */ mark match 0x4000/0x4000
ACCEPT     all  --  10.42.0.0/16         0.0.0.0/0            /* kubernetes forwarding conntrack pod source rule */ ctstate RELATED,ESTABLISHED
ACCEPT     all  --  0.0.0.0/0            10.42.0.0/16         /* kubernetes forwarding conntrack pod destination rule */ ctstate RELATED,ESTABLISHED

Chain KUBE-KUBELET-CANARY (0 references)
target     prot opt source               destination

Chain KUBE-PROXY-CANARY (0 references)
target     prot opt source               destination

Chain KUBE-SERVICES (3 references)
target     prot opt source               destination
```

```
> iptables -t nat -L -n
Chain PREROUTING (policy ACCEPT)
target     prot opt source               destination
KUBE-SERVICES  all  --  0.0.0.0/0            0.0.0.0/0            /* kubernetes service portals */

Chain INPUT (policy ACCEPT)
target     prot opt source               destination

Chain OUTPUT (policy ACCEPT)
target     prot opt source               destination
KUBE-SERVICES  all  --  0.0.0.0/0            0.0.0.0/0            /* kubernetes service portals */

Chain POSTROUTING (policy ACCEPT)
target     prot opt source               destination
KUBE-POSTROUTING  all  --  0.0.0.0/0            0.0.0.0/0            /* kubernetes postrouting rules */
KILO-NAT   all  --  0.0.0.0/0            0.0.0.0/0            /* Kilo: NAT packets from Kilo interface */ mark match 0x1107/0x1107        KILO-NAT   all  --  10.42.0.0/24         0.0.0.0/0            /* Kilo: jump to NAT chain */

Chain KILO-NAT (2 references)
target     prot opt source               destination
RETURN     all  --  0.0.0.0/0            10.42.0.0/24         /* Kilo: do not NAT packets destined for the local Pod subnet */
RETURN     all  --  0.0.0.0/0            10.4.0.0/16          /* Kilo: do not NAT packets destined for the Kilo subnet */
RETURN     all  --  0.0.0.0/0            10.1.20.3            /* Kilo: do not NAT packets destined for the local private IP */
MASQUERADE  all  --  0.0.0.0/0            0.0.0.0/0            /* Kilo: NAT remaining packets */

Chain KUBE-KUBELET-CANARY (0 references)
target     prot opt source               destination

Chain KUBE-MARK-DROP (0 references)
target     prot opt source               destination
MARK       all  --  0.0.0.0/0            0.0.0.0/0            MARK or 0x8000

Chain KUBE-MARK-MASQ (10 references)
target     prot opt source               destination
MARK       all  --  0.0.0.0/0            0.0.0.0/0            MARK or 0x4000

Chain KUBE-NODEPORTS (1 references)
target     prot opt source               destination

Chain KUBE-POSTROUTING (1 references)
target     prot opt source               destination
MASQUERADE  all  --  0.0.0.0/0            0.0.0.0/0            /* kubernetes service traffic requiring SNAT */ mark match 0x4000/0x4000   
Chain KUBE-PROXY-CANARY (0 references)
target     prot opt source               destination

Chain KUBE-SEP-3PH6UQJMDKX4V55V (1 references)
target     prot opt source               destination
KUBE-MARK-MASQ  all  --  <master-public-ip>      0.0.0.0/0
DNAT       tcp  --  0.0.0.0/0            0.0.0.0/0            tcp to:<master-public-ip>:6443

Chain KUBE-SEP-7AFK7QBGDHWZ2GEU (1 references)
target     prot opt source               destination
KUBE-MARK-MASQ  all  --  10.42.1.3            0.0.0.0/0
DNAT       tcp  --  0.0.0.0/0            0.0.0.0/0            tcp to:10.42.1.3:9153

Chain KUBE-SEP-HXJOFAAC2M25JRTQ (1 references)
target     prot opt source               destination
KUBE-MARK-MASQ  all  --  10.42.1.4            0.0.0.0/0
DNAT       tcp  --  0.0.0.0/0            0.0.0.0/0            tcp to:10.42.1.4:80

Chain KUBE-SEP-PCJJFSWHCYBSYBAN (1 references)
target     prot opt source               destination
KUBE-MARK-MASQ  all  --  10.42.1.3            0.0.0.0/0
DNAT       tcp  --  0.0.0.0/0            0.0.0.0/0            tcp to:10.42.1.3:53

Chain KUBE-SEP-ZROOOGDTFBYPOKDJ (1 references)
target     prot opt source               destination
KUBE-MARK-MASQ  all  --  10.42.1.3            0.0.0.0/0
DNAT       udp  --  0.0.0.0/0            0.0.0.0/0            udp to:10.42.1.3:53

Chain KUBE-SERVICES (2 references)
target     prot opt source               destination
KUBE-MARK-MASQ  tcp  -- !10.42.0.0/16         10.43.0.1            /* default/kubernetes:https cluster IP */ tcp dpt:443
KUBE-SVC-NPX46M4PTMTKRN6Y  tcp  --  0.0.0.0/0            10.43.0.1            /* default/kubernetes:https cluster IP */ tcp dpt:443       KUBE-MARK-MASQ  tcp  -- !10.42.0.0/16         10.43.0.10           /* kube-system/kube-dns:metrics cluster IP */ tcp dpt:9153
KUBE-SVC-JD5MR3NA4I4DYORP  tcp  --  0.0.0.0/0            10.43.0.10           /* kube-system/kube-dns:metrics cluster IP */ tcp dpt:9153  KUBE-MARK-MASQ  udp  -- !10.42.0.0/16         10.43.0.10           /* kube-system/kube-dns:dns cluster IP */ udp dpt:53
KUBE-SVC-TCOU7JCQXEZGVUNU  udp  --  0.0.0.0/0            10.43.0.10           /* kube-system/kube-dns:dns cluster IP */ udp dpt:53        KUBE-MARK-MASQ  tcp  -- !10.42.0.0/16         10.43.0.10           /* kube-system/kube-dns:dns-tcp cluster IP */ tcp dpt:53
KUBE-SVC-ERIFXISQEP7F7OF4  tcp  --  0.0.0.0/0            10.43.0.10           /* kube-system/kube-dns:dns-tcp cluster IP */ tcp dpt:53    KUBE-MARK-MASQ  tcp  -- !10.42.0.0/16         10.43.253.67         /* default/my-nginx: cluster IP */ tcp dpt:80
KUBE-SVC-BEPXDJBUHFCSYIC3  tcp  --  0.0.0.0/0            10.43.253.67         /* default/my-nginx: cluster IP */ tcp dpt:80
KUBE-NODEPORTS  all  --  0.0.0.0/0            0.0.0.0/0            /* kubernetes service nodeports; NOTE: this must be the last rule in this chain */ ADDRTYPE match dst-type LOCAL

Chain KUBE-SVC-BEPXDJBUHFCSYIC3 (1 references)
target     prot opt source               destination
KUBE-SEP-HXJOFAAC2M25JRTQ  all  --  0.0.0.0/0            0.0.0.0/0

Chain KUBE-SVC-ERIFXISQEP7F7OF4 (1 references)
target     prot opt source               destination
KUBE-SEP-PCJJFSWHCYBSYBAN  all  --  0.0.0.0/0            0.0.0.0/0

Chain KUBE-SVC-JD5MR3NA4I4DYORP (1 references)
target     prot opt source               destination
KUBE-SEP-7AFK7QBGDHWZ2GEU  all  --  0.0.0.0/0            0.0.0.0/0

Chain KUBE-SVC-NPX46M4PTMTKRN6Y (1 references)
target     prot opt source               destination
KUBE-SEP-3PH6UQJMDKX4V55V  all  --  0.0.0.0/0            0.0.0.0/0

Chain KUBE-SVC-TCOU7JCQXEZGVUNU (1 references)
target     prot opt source               destination
KUBE-SEP-ZROOOGDTFBYPOKDJ  all  --  0.0.0.0/0            0.0.0.0/0
```

on `oci-worker`

```
> iptables -L -n
Chain INPUT (policy ACCEPT)
target     prot opt source               destination
KUBE-SERVICES  all  --  0.0.0.0/0            0.0.0.0/0            ctstate NEW /* kubernetes service portals */
KUBE-EXTERNAL-SERVICES  all  --  0.0.0.0/0            0.0.0.0/0            ctstate NEW /* kubernetes externally-visible service portals */KUBE-FIREWALL  all  --  0.0.0.0/0            0.0.0.0/0

Chain FORWARD (policy ACCEPT)
target     prot opt source               destination
KUBE-FORWARD  all  --  0.0.0.0/0            0.0.0.0/0            /* kubernetes forwarding rules */
KUBE-SERVICES  all  --  0.0.0.0/0            0.0.0.0/0            ctstate NEW /* kubernetes service portals */
ACCEPT     all  --  10.4.0.0/16          0.0.0.0/0
ACCEPT     all  --  0.0.0.0/0            10.4.0.0/16

Chain OUTPUT (policy ACCEPT)
target     prot opt source               destination
KUBE-SERVICES  all  --  0.0.0.0/0            0.0.0.0/0            ctstate NEW /* kubernetes service portals */
KUBE-FIREWALL  all  --  0.0.0.0/0            0.0.0.0/0

Chain KUBE-EXTERNAL-SERVICES (1 references)
target     prot opt source               destination

Chain KUBE-FIREWALL (2 references)
target     prot opt source               destination
DROP       all  --  0.0.0.0/0            0.0.0.0/0            /* kubernetes firewall for dropping marked packets */ mark match 0x8000/0x8000

Chain KUBE-FORWARD (1 references)
target     prot opt source               destination
DROP       all  --  0.0.0.0/0            0.0.0.0/0            ctstate INVALID
ACCEPT     all  --  0.0.0.0/0            0.0.0.0/0            /* kubernetes forwarding rules */ mark match 0x4000/0x4000
ACCEPT     all  --  10.42.0.0/16         0.0.0.0/0            /* kubernetes forwarding conntrack pod source rule */ ctstate RELATED,ESTABLISHED
ACCEPT     all  --  0.0.0.0/0            10.42.0.0/16         /* kubernetes forwarding conntrack pod destination rule */ ctstate RELATED,ESTABLISHED

Chain KUBE-KUBELET-CANARY (0 references)
target     prot opt source               destination

Chain KUBE-PROXY-CANARY (0 references)
target     prot opt source               destination

Chain KUBE-SERVICES (3 references)
target     prot opt source               destination
```

```
> iptables -t nat -L -n
Chain PREROUTING (policy ACCEPT)
target     prot opt source               destination
KUBE-SERVICES  all  --  0.0.0.0/0            0.0.0.0/0            /* kubernetes service portals */

Chain INPUT (policy ACCEPT)
target     prot opt source               destination

Chain OUTPUT (policy ACCEPT)
target     prot opt source               destination
KUBE-SERVICES  all  --  0.0.0.0/0            0.0.0.0/0            /* kubernetes service portals */

Chain POSTROUTING (policy ACCEPT)
target     prot opt source               destination
KUBE-POSTROUTING  all  --  0.0.0.0/0            0.0.0.0/0            /* kubernetes postrouting rules */
KILO-NAT   all  --  0.0.0.0/0            0.0.0.0/0            /* Kilo: NAT packets from Kilo interface */ mark match 0x1107/0x1107        KILO-NAT   all  --  10.42.1.0/24         0.0.0.0/0            /* Kilo: jump to NAT chain */

Chain KILO-NAT (2 references)
target     prot opt source               destination
RETURN     all  --  0.0.0.0/0            10.42.1.0/24         /* Kilo: do not NAT packets destined for the local Pod subnet */
RETURN     all  --  0.0.0.0/0            10.4.0.0/16          /* Kilo: do not NAT packets destined for the Kilo subnet */
RETURN     all  --  0.0.0.0/0            10.1.20.2            /* Kilo: do not NAT packets destined for the local private IP */
MASQUERADE  all  --  0.0.0.0/0            0.0.0.0/0            /* Kilo: NAT remaining packets */

Chain KUBE-KUBELET-CANARY (0 references)
target     prot opt source               destination

Chain KUBE-MARK-DROP (0 references)
target     prot opt source               destination
MARK       all  --  0.0.0.0/0            0.0.0.0/0            MARK or 0x8000

Chain KUBE-MARK-MASQ (10 references)
target     prot opt source               destination
MARK       all  --  0.0.0.0/0            0.0.0.0/0            MARK or 0x4000

Chain KUBE-NODEPORTS (1 references)
target     prot opt source               destination

Chain KUBE-POSTROUTING (1 references)
target     prot opt source               destination
MASQUERADE  all  --  0.0.0.0/0            0.0.0.0/0            /* kubernetes service traffic requiring SNAT */ mark match 0x4000/0x4000   
Chain KUBE-PROXY-CANARY (0 references)
target     prot opt source               destination

Chain KUBE-SEP-3PH6UQJMDKX4V55V (1 references)
target     prot opt source               destination
KUBE-MARK-MASQ  all  --  <master-public-ip>      0.0.0.0/0
DNAT       tcp  --  0.0.0.0/0            0.0.0.0/0            tcp to:<master-public-ip>:6443

Chain KUBE-SEP-7AFK7QBGDHWZ2GEU (1 references)
target     prot opt source               destination
KUBE-MARK-MASQ  all  --  10.42.1.3            0.0.0.0/0
DNAT       tcp  --  0.0.0.0/0            0.0.0.0/0            tcp to:10.42.1.3:9153

Chain KUBE-SEP-HXJOFAAC2M25JRTQ (1 references)
target     prot opt source               destination
KUBE-MARK-MASQ  all  --  10.42.1.4            0.0.0.0/0
DNAT       tcp  --  0.0.0.0/0            0.0.0.0/0            tcp to:10.42.1.4:80

Chain KUBE-SEP-PCJJFSWHCYBSYBAN (1 references)
target     prot opt source               destination
KUBE-MARK-MASQ  all  --  10.42.1.3            0.0.0.0/0
DNAT       tcp  --  0.0.0.0/0            0.0.0.0/0            tcp to:10.42.1.3:53

Chain KUBE-SEP-ZROOOGDTFBYPOKDJ (1 references)
target     prot opt source               destination
KUBE-MARK-MASQ  all  --  10.42.1.3            0.0.0.0/0
DNAT       udp  --  0.0.0.0/0            0.0.0.0/0            udp to:10.42.1.3:53

Chain KUBE-SERVICES (2 references)
target     prot opt source               destination
KUBE-MARK-MASQ  tcp  -- !10.42.0.0/16         10.43.0.1            /* default/kubernetes:https cluster IP */ tcp dpt:443
KUBE-SVC-NPX46M4PTMTKRN6Y  tcp  --  0.0.0.0/0            10.43.0.1            /* default/kubernetes:https cluster IP */ tcp dpt:443       KUBE-MARK-MASQ  tcp  -- !10.42.0.0/16         10.43.0.10           /* kube-system/kube-dns:dns-tcp cluster IP */ tcp dpt:53
KUBE-SVC-ERIFXISQEP7F7OF4  tcp  --  0.0.0.0/0            10.43.0.10           /* kube-system/kube-dns:dns-tcp cluster IP */ tcp dpt:53    KUBE-MARK-MASQ  tcp  -- !10.42.0.0/16         10.43.0.10           /* kube-system/kube-dns:metrics cluster IP */ tcp dpt:9153
KUBE-SVC-JD5MR3NA4I4DYORP  tcp  --  0.0.0.0/0            10.43.0.10           /* kube-system/kube-dns:metrics cluster IP */ tcp dpt:9153  KUBE-MARK-MASQ  udp  -- !10.42.0.0/16         10.43.0.10           /* kube-system/kube-dns:dns cluster IP */ udp dpt:53
KUBE-SVC-TCOU7JCQXEZGVUNU  udp  --  0.0.0.0/0            10.43.0.10           /* kube-system/kube-dns:dns cluster IP */ udp dpt:53        KUBE-MARK-MASQ  tcp  -- !10.42.0.0/16         10.43.253.67         /* default/my-nginx: cluster IP */ tcp dpt:80
KUBE-SVC-BEPXDJBUHFCSYIC3  tcp  --  0.0.0.0/0            10.43.253.67         /* default/my-nginx: cluster IP */ tcp dpt:80
KUBE-NODEPORTS  all  --  0.0.0.0/0            0.0.0.0/0            /* kubernetes service nodeports; NOTE: this must be the last rule in this chain */ ADDRTYPE match dst-type LOCAL

Chain KUBE-SVC-BEPXDJBUHFCSYIC3 (1 references)
target     prot opt source               destination
KUBE-SEP-HXJOFAAC2M25JRTQ  all  --  0.0.0.0/0            0.0.0.0/0

Chain KUBE-SVC-ERIFXISQEP7F7OF4 (1 references)
target     prot opt source               destination
KUBE-SEP-PCJJFSWHCYBSYBAN  all  --  0.0.0.0/0            0.0.0.0/0

Chain KUBE-SVC-JD5MR3NA4I4DYORP (1 references)
target     prot opt source               destination
KUBE-SEP-7AFK7QBGDHWZ2GEU  all  --  0.0.0.0/0            0.0.0.0/0

Chain KUBE-SVC-NPX46M4PTMTKRN6Y (1 references)
target     prot opt source               destination
KUBE-SEP-3PH6UQJMDKX4V55V  all  --  0.0.0.0/0            0.0.0.0/0

Chain KUBE-SVC-TCOU7JCQXEZGVUNU (1 references)
target     prot opt source               destination
KUBE-SEP-ZROOOGDTFBYPOKDJ  all  --  0.0.0.0/0            0.0.0.0/0
```

> 
> Let me know what you find,
> Lucas

Hope this helps! thank you for being so responsive!

**Comment by squat** [comment]
@kelvl 

> >On oci-worker: ip route get <source-ip>, plz report that, we need to ensure it matches the interface in which incoming packets arrive

>oci-worker's private ip is 10.1.20.2
On oci-worker the route looks like it comes from kube-bridge -- i think this might be wrong?

Sorry I think I wasn't clear, from oci-worker can we do 
`ip route get 10.1.20.3`
We want to see why the pings are not getting returned. eg maybe the route doesn't match.
It could also be very helpful to do the following: while pinging from the master, tcpdump on the worker to see what is happening to the ICMP, eg is a response getting returned and blackholed somewher? `sudo tcpdump -i any -n icmp`

Thanks for your effort @kelvl (:

**Comment by kelvl** [comment]
on oci-worker i get 
```
oci-wroker> ip route get 10.1.20.3
10.1.20.3 dev ens3 src 10.1.20.2 uid 0
    cache
```

tcpdumping on the worker while pinging the pod (pod is on the worker) from the master, i get nothing coming through

but if the master pings the worker ip address, we do see it as expected
```
oci-worker>  tcpdump -i any -n icmp
tcpdump: verbose output suppressed, use -v or -vv for full protocol decode
listening on any, link-type LINUX_SLL (Linux cooked), capture size 262144 bytes
12:45:51.669028 IP 10.1.20.3 > 10.1.20.2: ICMP echo request, id 16367, seq 0, length 64
12:45:51.669062 IP 10.1.20.2 > 10.1.20.3: ICMP echo reply, id 16367, seq 0, length 64
12:45:52.670083 IP 10.1.20.3 > 10.1.20.2: ICMP echo request, id 16367, seq 1, length 64
12:45:52.670110 IP 10.1.20.2 > 10.1.20.3: ICMP echo reply, id 16367, seq 1, length 64
```

**Comment by squat** [comment]
Hmm this sounds like the cloud provider you are on is applying some source/destination checks on packets hitting your machines. Sorry if I wasn't clear earlier, disabling the encapsulation will only work if the cloud supports disabling those chdcks :/ otherwise I'm sorry, we have to turn on encapsulation again

**Comment by kelvl** [comment]
no worries! thanks for the patience!

rebuilding the cluster, my pod is now at 10.42.1.2
```
local> kubectl get po -o wide
NAME                        READY   STATUS    RESTARTS   AGE     IP          NODE         NOMINATED NODE   READINESS GATES
my-nginx-74f94c7795-vnfnw   1/1     Running   0          2m37s   10.42.1.2   oci-worker   <none>           <none>
```

### Routes

on the worker
```
# getting route for master
worker> ip route get 10.1.20.3
10.1.20.3 dev ens3 src 10.1.20.2 uid 0
    cache

# getting route for pod
worker> ip route get 10.42.1.2
10.42.1.2 dev kube-bridge src 10.42.1.1 uid 0
    cache
```

on the master
```
# getting route for worker
master> ip route get 10.1.20.2
10.1.20.2 dev ens3 src 10.1.20.3 uid 0
    cache

# getting route for pod
master> ip route get 10.42.1.2
10.42.1.2 via 10.1.20.2 dev tunl0 src 10.42.0.1 uid 0
    cache
```

## Ping / tcpdump

### Pinging pod from master
```
# ping pod
master> ping 10.42.1.2
PING 10.42.1.2 (10.42.1.2): 56 data bytes
^C--- 10.42.1.2 ping statistics ---
4 packets transmitted, 0 packets received, 100% packet loss
```

tcp dumps 

on master
```
master>  tcpdump -i any -n icmp
tcpdump: verbose output suppressed, use -v or -vv for full protocol decode
listening on any, link-type LINUX_SLL (Linux cooked), capture size 262144 bytes
15:26:44.084795 IP 10.42.0.1 > 10.42.1.2: ICMP echo request, id 13685, seq 0, length 64
15:26:45.085267 IP 10.42.0.1 > 10.42.1.2: ICMP echo request, id 13685, seq 1, length 64
15:26:46.085666 IP 10.42.0.1 > 10.42.1.2: ICMP echo request, id 13685, seq 2, length 64
15:26:47.087149 IP 10.42.0.1 > 10.42.1.2: ICMP echo request, id 13685, seq 3, length 64
```

on worker
```
worker>  tcpdump -i any -n icmp
tcpdump: verbose output suppressed, use -v or -vv for full protocol decode
listening on any, link-type LINUX_SLL (Linux cooked), capture size 262144 bytes
```

### Pinging pod from worker

```
worker> ping 10.42.1.2
PING 10.42.1.2 (10.42.1.2): 56 data bytes
64 bytes from 10.42.1.2: icmp_seq=0 ttl=64 time=0.143 ms
64 bytes from 10.42.1.2: icmp_seq=1 ttl=64 time=0.054 ms
^C--- 10.42.1.2 ping statistics ---
2 packets transmitted, 2 packets received, 0% packet loss
round-trip min/avg/max/stddev = 0.054/0.098/0.143/0.045 ms
```

worker tcpdump
```
worker> tcpdump -i any -n icmp
tcpdump: verbose output suppressed, use -v or -vv for full protocol decode
listening on any, link-type LINUX_SLL (Linux cooked), capture size 262144 bytes
15:29:09.852295 IP 10.42.1.1 > 10.42.1.2: ICMP echo request, id 16294, seq 0, length 64
15:29:09.852301 IP 10.42.1.1 > 10.42.1.2: ICMP echo request, id 16294, seq 0, length 64
15:29:09.852312 IP 10.42.1.2 > 10.42.1.1: ICMP echo reply, id 16294, seq 0, length 64
15:29:09.852312 IP 10.42.1.2 > 10.42.1.1: ICMP echo reply, id 16294, seq 0, length 64
15:29:10.853307 IP 10.42.1.1 > 10.42.1.2: ICMP echo request, id 16294, seq 1, length 64
15:29:10.853313 IP 10.42.1.1 > 10.42.1.2: ICMP echo request, id 16294, seq 1, length 64
15:29:10.853325 IP 10.42.1.2 > 10.42.1.1: ICMP echo reply, id 16294, seq 1, length 64
15:29:10.853325 IP 10.42.1.2 > 10.42.1.1: ICMP echo reply, id 16294, seq 1, length 64
```

master tcpdump
```
master> tcpdump -i any -n icmp
tcpdump: verbose output suppressed, use -v or -vv for full protocol decode
listening on any, link-type LINUX_SLL (Linux cooked), capture size 262144 bytes
```

**Comment by kelvl** [comment]
with the IPIP turned on should we be expecting that we be sending out encapsulated packets? 
ie: pings from 10.42.0.1 -> 10.42.1.2 be translated to 10.1.20.3 -> 10.1.20.2?

**Comment by squat** [comment]
Yes exactly. These of course won't show up directly as ICMP but rather as IPIP. The way to query tcpdump for these is `sudo tcpdump -i any -n proto 4 and host <IP>` This would be very helpful to see. We want to make sure that the IPIP packets are making their way to the worker. And if they are, then we can investigate why they are being dropped.

**Comment by kelvl** [comment]
Sorry for the slow replies, i can only do this after i get back home from work.

Doing the dump as you suggested and looks like the encapsulation is working
```
master> tcpdump -i any -n proto 4 and host 10.1.20.3
tcpdump: verbose output suppressed, use -v or -vv for full protocol decode
listening on any, link-type LINUX_SLL (Linux cooked), capture size 262144 bytes
09:43:41.811054 IP 10.1.20.3 > 10.1.20.2: IP 10.42.0.1 > 10.42.1.2: ICMP echo request, id 20039, seq 0, length 64 (ipip-proto-4)
09:43:42.812084 IP 10.1.20.3 > 10.1.20.2: IP 10.42.0.1 > 10.42.1.2: ICMP echo request, id 20039, seq 1, length 64 (ipip-proto-4)
09:43:43.813211 IP 10.1.20.3 > 10.1.20.2: IP 10.42.0.1 > 10.42.1.2: ICMP echo request, id 20039, seq 2, length 64 (ipip-proto-4)
```

But doing the same dump in the worker node, nothing seems to be coming through
```
worker> tcpdump -i any -n proto 4 and host 10.1.20.2
tcpdump: verbose output suppressed, use -v or -vv for full protocol decode
listening on any, link-type LINUX_SLL (Linux cooked), capture size 262144 bytes
```

even relaxing the rules and just looking at anything IPIP -- nothing is coming through

```
tcpdump -i any -n proto 4
tcpdump: verbose output suppressed, use -v or -vv for full protocol decode
listening on any, link-type LINUX_SLL (Linux cooked), capture size 262144 bytes
```

**Comment by squat** [comment]
No worries at all! Thanks for being so responsive and for trying things out.

This definitely sounds to me like IPIP traffic is being filtered by your cloud provider. You may need to explicitly enable it in your firewall. Eg in AWS you have to add IPIP to the security groups; digital ocean simply doesn't support IPIP at all etc. What cloud are you on?

**Comment by kelvl** [comment]
I'm on oracle! It turns out that I am just very confused by the security group settings on the cloud provider... T-T

I took everything out and just tried setting up a IPIP tunnel between the 2 machines to make sure that i got things right

on master
```
ip tunnel add ipip_a_tun0 mode ipip local 10.1.20.3 remote 10.1.20.2 dev ens3
ip link set ipip_a_tun0 up
ip addr add 172.31.1.1/30 dev ipip_a_tun0
```

on worker
```
ip tunnel add ipip_b_tun0 mode ipip local 10.1.20.2 remote 10.1.20.3 dev ens3
ip link set ipip_b_tun0 up
ip addr add 172.31.1.2/30 dev ipip_b_tun0
```

even with that it didn't work, so i suspected that i mis-configured my security groups. 
once i took out all the security group settings the pings started to work, and it turns out that IPIP was the wrong proto and i should be using IP-in-IP instead

![image](https://user-images.githubusercontent.com/1312703/74241478-13344280-4d17-11ea-8cfd-be5a74fd8e98.png)

Once I added that everything is working fine, i rolled out the multi cluster set up and things work out of the box (i did have to ensure that i have no private IP collisions but otherwise things worked great!)

Sorry that it turned out to be my fault (almost always). 
I learnt a lot through this ordeal :p 
Thank you for being super helpful and responsive and patient.

**Comment by squat** [comment]
Amazing! I'm so glad It Just Worked (TM)! :+1:
