### ISSUE TITLE
kubectl logs gives net/http: TLS handshake timeout

### ISSUE THREAD

**Issue by Jonathan-Eid** [squat/kilo#385]
I have two masters in gcp

I have aws meshes with two nodes in two locations each.

Let's focus on what's going on in location `ca-central-1` 

When I call kubectl logs on a pod on the follower ndoe in `ca-central-1`, half the time i get `Error from server: Get "https://172.31.26.39:10250/containerLogs/gpu-operator/gpu-operator-node-feature-discovery-worker-ljn22/worker": net/http: TLS handshake timeout`

Traffic from First Master to this node looks like this 

```
16:52:08.288725 IP ip-172-31-25-80.ca-central-1.compute.internal > ip-172-31-26-39.ca-central-1.compute.internal: IP ip-10-4-0-3.ca-central-1.compute.internal.37196 > ip-172-31-26-39.ca-central-1.compute.internal.10250: Flags [P.], seq 5556:5593, ack 748964, win 1154, options [nop,nop,TS val 950313407 ecr 1691875052], length 37
16:52:08.289055 IP ip-172-31-26-39.ca-central-1.compute.internal > ip-172-31-25-80.ca-central-1.compute.internal: IP ip-172-31-26-39.ca-central-1.compute.internal.10250 > ip-10-4-0-3.ca-central-1.compute.internal.37196: Flags [P.], seq 748964:749020, ack 5593, win 475, options [nop,nop,TS val 1691891642 ecr 950313407], length 56
```

Traffic from the Second Master to this node looks like this 

```
16:52:07.501337 IP ip-172-31-25-80.ca-central-1.compute.internal > ip-172-31-26-39.ca-central-1.compute.internal: IP ip-192-168-1-1.ca-central-1.compute.internal.48890 > ip-172-31-26-39.ca-central-1.compute.internal.10250: Flags [P.], seq 8387:8422, ack 1086863, win 1347, options [nop,nop,TS val 434339278 ecr 3440968081], length 35
16:52:07.501358 IP ip-172-31-26-39.ca-central-1.compute.internal > ip-172-31-25-80.ca-central-1.compute.internal: IP ip-172-31-26-39.ca-central-1.compute.internal.10250 > ip-192-168-1-1.ca-central-1.compute.internal.48890: Flags [P.], seq 1107529:1108814, ack 8387, win 475, options [nop,nop,TS val 3440968172 ecr 434339278], length 1285
```

Definitely when the second master picks up the kubectl logs call, it starts to hang and throws that error

This error only goes away when i open the kubelet port `10250` to all traffic for that AWS ca-central-1 VM node's security group.

Even when if I just open port `10250` to every single external and internal IP of each node in the cluster, I still get this TLS handshake timeout error

![image](https://github.com/squat/kilo/assets/16027108/d8f39567-d495-4f79-87da-7a8d2c3e3f32)

**Comment by Jonathan-Eid** [comment]
Does this issue have anything to do with MTU & MSS even though the issue goes away after opening the 10250 port completely?

**Comment by Jonathan-Eid** [comment]
weird that opening port 10250 also worked, but I solved this issue by enabling ICMP (also IPIP just incase) in the security group for the CIDR of the VPC the aws instances were in
